{
  "number": 439,
  "title": "യേശുവേ നിന്തിരു വചനമിപ്പോൾ",
  "parts": [
    {
      "id": "c",
      "kind": "chorus",
      "lines": [
        "യേശുവേ നിന്തിരു വചനമിപ്പോൾ",
        "ആശിഷമോടു നൽകിടണമേ",
        "മറിയയെപ്പോൽ നിൻ തിരുപ്പാദത്തിൽ",
        "ഇരുന്നുകൊണ്ടാശയിൽ നിന്നെ നോക്കുന്നു"
      ]
    },
    {
      "id": "s1",
      "kind": "stanza",
      "label": "1",
      "lines": [
        "തിരുവെഴുത്തുകളോടു ദിവ്യശക്തിയും",
        "അറിയാഞ്ഞാലടിയങ്ങൾ പിഴച്ചിടുമേ",
        "കരുണയോടെ നീ ബുദ്ധി തുറന്നു",
        "മറപൊരുളായതു തെളിവാക്കുകേ"
      ]
    },
    {
      "id": "s2",
      "kind": "stanza",
      "label": "2",
      "lines": [
        "അനുസരിച്ചിടുന്നൊരു മനസ്സുളേളാരായ്",
        "മനുജന്റേതല്ലിതു പരൻ വചനം",
        "എന്നെല്ലാപേരും അനുഭവിപ്പാൻ",
        "വന്നു നിൻശക്തിയാലരുളിടുക"
      ]
    },
    {
      "id": "s3",
      "kind": "stanza",
      "label": "3",
      "lines": [
        "നിൻതിരു സത്യത്തെ ഹൃദയമതിൽ",
        "പിന്തിരിയാതെ കൈക്കൊണ്ടിടുവാൻ",
        "ഇന്ദ്രിയങ്ങളെല്ലാം ക്രമപ്പെടുത്തി",
        "നിൻവിശുദ്ധാത്മാവാൽ ഭരിക്കേണമേ"
      ]
    },
    {
      "id": "s4",
      "kind": "stanza",
      "label": "4",
      "lines": [
        "വേദത്തിൻ കാതലാം നിന്നിൽ",
        "ഞങ്ങൾ ഭേദമില്ലാതെ വസിച്ചിടുവാൻ",
        "ഖേദമുളള എല്ലാ വഴികളെയും",
        "ബോധം വരുത്തുക പരിശുദ്ധനേ!"
      ]
    },
    {
      "id": "s5",
      "kind": "stanza",
      "label": "5",
      "lines": [
        "വിണ്ണിൽ നിൻതിരുമുഖം കാണുംവരെ",
        "മണ്ണിൽ ജീവിക്കും നാളെന്നും ഞങ്ങൾ",
        "കണ്ണാടിയാം നിന്റെ സുവിശേഷത്തിൽ",
        "നിന്നെക്കണ്ടാശയിൽ ആനന്ദിപ്പാൻ"
      ]
    }
  ],
  "sequence": [
    {
      "partId": "c"
    },
    {
      "partId": "s1"
    },
    {
      "partId": "c"
    },
    {
      "partId": "s2"
    },
    {
      "partId": "c"
    },
    {
      "partId": "s3"
    },
    {
      "partId": "c"
    },
    {
      "partId": "s4"
    },
    {
      "partId": "c"
    },
    {
      "partId": "s5"
    },
    {
      "partId": "c"
    }
  ],
  "meta": {
    "author": "VN"
  }
}
