{
  "number": 369,
  "title": "പരമദേവാ! നിന്നാത്മകൃപ",
  "parts": [
    {
      "id": "c",
      "kind": "chorus",
      "lines": [
        "പരമദേവാ! നിന്നാത്മകൃപ",
        "ചൊരിയേണമിസ്സഭയിൽ",
        "തിരുനാമം വിളങ്ങിടാൻ"
      ]
    },
    {
      "id": "s1",
      "kind": "stanza",
      "label": "1",
      "lines": [
        "നിന്നരുളനുസരിച്ചിന്നരർ നടപ്പതി",
        "ന്നരുൾക നിന്നാശിഷം നീ"
      ]
    },
    {
      "id": "s2",
      "kind": "stanza",
      "label": "2",
      "lines": [
        "വിശ്വാസ ജീവിതത്തി -",
        "ന്നാശ്വാസം തെരിയാത്ത",
        "സംശയക്കാർ നിന്നോടടുപ്പാൻ"
      ]
    },
    {
      "id": "s3",
      "kind": "stanza",
      "label": "3",
      "lines": [
        "ലോകമോഹങ്ങളാത്മ",
        "ദേഹത്തെ ക്ഷയിപ്പിക്കും",
        "കാലമിതിൽ നിൻ കാരുണ്യത്താൽ"
      ]
    },
    {
      "id": "s4",
      "kind": "stanza",
      "label": "4",
      "lines": [
        "ദുർഘടയുഗമിതിലൂ -",
        "ക്കമായ് നിലനിന്നു",
        "ഭക്തിയെന്നും ഞാനഭ്യസിപ്പാൻ"
      ]
    },
    {
      "id": "s5",
      "kind": "stanza",
      "label": "5",
      "lines": [
        "സത്യസുവിശേഷത്തിൻ",
        "നിത്യസമാധാനമായ്",
        "ഭക്തരിൽ നീ പ്രത്യക്ഷനല്ലോ"
      ]
    }
  ],
  "sequence": [
    {
      "partId": "c"
    },
    {
      "partId": "s1"
    },
    {
      "partId": "c"
    },
    {
      "partId": "s2"
    },
    {
      "partId": "c"
    },
    {
      "partId": "s3"
    },
    {
      "partId": "c"
    },
    {
      "partId": "s4"
    },
    {
      "partId": "c"
    },
    {
      "partId": "s5"
    },
    {
      "partId": "c"
    }
  ],
  "meta": {
    "author": "KVS"
  }
}
