{
  "number": 1608,
  "title": "ഒരുനാൾ, ഒരുനാൾ, ഒരുനാൾ",
  "parts": [
    {
      "id": "c",
      "kind": "chorus",
      "lines": [
        "ഒരുനാൾ, ഒരുനാൾ, ഒരുനാൾ",
        "മരണം മാടി വിളിക്കും",
        "മറക്കല്ലേ മനുഷ്യാ നിന്നുടെ ജീവൻ",
        "മറഞ്ഞുപോകും നിഴലല്ലോ!"
      ]
    },
    {
      "id": "s1",
      "kind": "stanza",
      "label": "1",
      "lines": [
        "സ്വർഗ്ഗത്തിൽ പോയാലും",
        "നരകത്തിൽ പോയാലും",
        "നിത്യത മുഴുവൻ അവിടെത്തന്നെ",
        "നരകത്തീയിൽ എരിപൊരി പൂണ്ടു",
        "അയ്യം വിളിക്കുമെന്നോർത്തിടുക"
      ]
    },
    {
      "id": "s2",
      "kind": "stanza",
      "label": "2",
      "lines": [
        "ചാകാത്ത കൃമികൾ പുതപ്പാണവിടെ",
        "ഭീകരത നിൻ കൂട്ടാകും",
        "ദാഹിച്ചവശനായ് തീരുമെന്നാകിലും",
        "ദാഹജലം അവിടില്ലല്ലോ"
      ]
    },
    {
      "id": "s3",
      "kind": "stanza",
      "label": "3",
      "lines": [
        "സ്വർഗ്ഗത്തിൽ എപ്പോഴും ആനന്ദത്തിൻ",
        "സുന്ദര ഗാന തരംഗങ്ങൾ",
        "കണ്ണീരില്ല മുറവിളിയില്ല",
        "പൈദാഹവുമവിടില്ലല്ലോ"
      ]
    },
    {
      "id": "s4",
      "kind": "stanza",
      "label": "4",
      "lines": [
        "നിനക്കായ് ക്രൂശിൽ മരണം വരിച്ച്",
        "യേശു നിന്നെ വിളിക്കുന്നു",
        "യേശുവിനായ് നിൻ ഹൃദയകവാടം",
        "തുറന്നിടു സോദരാ ഈ സമയം"
      ]
    },
    {
      "id": "s5",
      "kind": "stanza",
      "label": "5",
      "lines": [
        "മരണത്തിൻ മുമ്പേ യേശുവിനെ നീ",
        "കർത്താവായ് സ്വീകരിച്ചാൽ",
        "ചേർത്തുകൊളളും യേശു മണവാളൻ",
        "സ്വർഗ്ഗരാജ്യ നിന്നെയും"
      ]
    }
  ],
  "sequence": [
    {
      "partId": "c"
    },
    {
      "partId": "s1"
    },
    {
      "partId": "c"
    },
    {
      "partId": "s2"
    },
    {
      "partId": "c"
    },
    {
      "partId": "s3"
    },
    {
      "partId": "c"
    },
    {
      "partId": "s4"
    },
    {
      "partId": "c"
    },
    {
      "partId": "s5"
    },
    {
      "partId": "c"
    }
  ],
  "meta": {
    "author": "PCK"
  }
}
