{
  "number": 1028,
  "title": "വരും പ്രാണപ്രിയൻ വിരവിൽ",
  "parts": [
    {
      "id": "c",
      "kind": "chorus",
      "lines": [
        "വരും പ്രാണപ്രിയൻ വിരവിൽ",
        "തന്റെ കാന്തയെ ചേർത്തിടുവാൻ",
        "തന്റെ രക്തത്താൽ വീണ്ടെടുത്ത പ്രിയയെ",
        "തൻകൂടെന്നെന്നും വാണിടുവാൻ"
      ]
    },
    {
      "id": "s1",
      "kind": "stanza",
      "label": "1",
      "lines": [
        "ലോകരാഷ്ട്രങ്ങളാകവേയിളകും",
        "അതിൻ ശക്തിയോ ബലഹീനമാകും",
        "കർത്തൻ വരവിനെ കാത്തിടും ശുദ്ധരോ",
        "അവർ പുതുക്കിടും ശക്തിയെ ദിനവും"
      ]
    },
    {
      "id": "s2",
      "kind": "stanza",
      "label": "2",
      "lines": [
        "കഷ്ടം നിന്ദകളേറി വരികിലും",
        "കഷ്ടം സഹിച്ചവൻ കൂടെയുണ്ടെന്നും",
        "തിരുസാന്നിദ്ധ്യം ആനന്ദം നൽകും",
        "തിരുക്കരങ്ങളാൽ താങ്ങി നടത്തും"
      ]
    },
    {
      "id": "s3",
      "kind": "stanza",
      "label": "3",
      "lines": [
        "മണവാളൻ തൻ വരവു സമീപം",
        "ഉണർന്നിടുക നാം അതിവേഗം",
        "തെളിയിച്ചിടുക നമ്മൾ ദീപം",
        "അന്നു ചേർന്നിടും നാം തൻ സമീപം"
      ]
    },
    {
      "id": "s4",
      "kind": "stanza",
      "label": "4",
      "lines": [
        "വാട്ടം മാലിന്യം ലേശമില്ലാത്ത",
        "സ്വർഗ്ഗനാടതിൽ വാണിടും മോദാൽ",
        "തേജസ്സോടെ നാം യേശുവിൻകൂടെ",
        "വാഴും ശോഭാപരിപൂർണ്ണരായി"
      ]
    }
  ],
  "sequence": [
    {
      "partId": "c"
    },
    {
      "partId": "s1"
    },
    {
      "partId": "c"
    },
    {
      "partId": "s2"
    },
    {
      "partId": "c"
    },
    {
      "partId": "s3"
    },
    {
      "partId": "c"
    },
    {
      "partId": "s4"
    },
    {
      "partId": "c"
    }
  ],
  "meta": {
    "author": "TVS"
  }
}
