{
  "number": 215,
  "title": "വന്ദനം വന്ദനം നാഥാ",
  "parts": [
    {
      "id": "c",
      "kind": "chorus",
      "lines": [
        "വന്ദനം വന്ദനം നാഥാ",
        "നിന്റെ രക്ഷയ്ക്കായ്‌ വന്ദനം"
      ]
    },
    {
      "id": "s1",
      "kind": "stanza",
      "label": "1",
      "lines": [
        "ഉന്നതത്തിൽ നിന്നു എന്നെ പ്രതി",
        "മന്നിൽ വന്ന നാഥനേ!വന്ദനം"
      ]
    },
    {
      "id": "s2",
      "kind": "stanza",
      "label": "2",
      "lines": [
        "നന്ദിയോടെ ഇന്നു നിന്റെ ദാസൻ",
        "വന്ദിക്കുന്നു മന്നനേ!വന്ദനം"
      ]
    },
    {
      "id": "s3",
      "kind": "stanza",
      "label": "3",
      "lines": [
        "ശത്രുവായ എന്നെയോർത്തു നിന്റെ",
        "പുത്രനാക്കി തീർത്തതാൽ!വന്ദനം"
      ]
    },
    {
      "id": "s4",
      "kind": "stanza",
      "label": "4",
      "lines": [
        "4.എന്റെ നാമം ജീവപുസ്തകത്തിൽ",
        "ചേർത്തിതനെയോർത്തിതാ!വന്ദനം"
      ]
    },
    {
      "id": "s5",
      "kind": "stanza",
      "label": "5",
      "lines": [
        "എന്തുമോദം എന്റെ അന്തരംഗേ",
        "സന്തതം വിലസിടുന്നു!വന്ദനം"
      ]
    }
  ],
  "sequence": [
    {
      "partId": "c"
    },
    {
      "partId": "s1"
    },
    {
      "partId": "c"
    },
    {
      "partId": "s2"
    },
    {
      "partId": "c"
    },
    {
      "partId": "s3"
    },
    {
      "partId": "c"
    },
    {
      "partId": "s4"
    },
    {
      "partId": "c"
    },
    {
      "partId": "s5"
    },
    {
      "partId": "c"
    }
  ],
  "meta": {
    "author": "PVT"
  }
}
