{
  "number": 40,
  "title": "സ്തുതിച്ചിടും ഞാൻ",
  "parts": [
    {
      "id": "c",
      "kind": "chorus",
      "lines": [
        "സ്തുതിച്ചിടും ഞാൻ",
        "സ്തുതിച്ചിടും ഞാൻ",
        "മഹോന്നതനാം മനോഹരനാം",
        "മമ പ്രിയനെ"
      ]
    },
    {
      "id": "s1",
      "kind": "stanza",
      "label": "1",
      "lines": [
        "പാപം പോക്കിയെൻ ശാപം നീക്കി - വൻ",
        "താപം തീർത്തവനെ എന്നും",
        "സ്തുതിക്കും വീണു നമിക്കും",
        "പാടിപ്പുകഴ്ത്തിടും ഞാൻ",
        "സ്നേഹനിധെ കൃപാപതിയെ",
        "കരുണാനദിയെ പരമാനന്ദമായ്"
      ]
    },
    {
      "id": "s2",
      "kind": "stanza",
      "label": "2",
      "lines": [
        "കാണാതകന്നു പാപക്കുഴിയിൽ",
        "വീണുവലഞ്ഞിടവേ തേടിയെന്നെയും",
        "നല്ലിടയൻ പാടു സഹിച്ചധികം",
        "തങ്കനിണം വിലയായ് കൊടുത്തു",
        "എൻ പ്രിയനെന്നെയും വീണ്ടെടുത്തു"
      ]
    },
    {
      "id": "s3",
      "kind": "stanza",
      "label": "3",
      "lines": [
        "കണ്ണീർപാതയിൽ നിന്നെൻ കൺകളെ",
        "കാത്തു സൂക്ഷിച്ചവൻ വീഴ്ചയിൽ നിന്നെൻ",
        "കാൽകളെയും വീഴ്ചയെന്നിയേ താൻ",
        "മൃത്യുവിൽനിന്നെൻ പ്രാണനേയും",
        "വിടുതൽ ചെയ്തു എന്നെന്നേക്കുമായ്"
      ]
    }
  ],
  "sequence": [
    {
      "partId": "c"
    },
    {
      "partId": "s1"
    },
    {
      "partId": "c"
    },
    {
      "partId": "s2"
    },
    {
      "partId": "c"
    },
    {
      "partId": "s3"
    },
    {
      "partId": "c"
    }
  ],
  "meta": {
    "author": "GP"
  }
}
