{
  "number": 538,
  "title": "എനിക്കിനി ജീവൻ ക്രിസ്തുവത്രേ",
  "parts": [
    {
      "id": "c",
      "kind": "chorus",
      "lines": [
        "എനിക്കിനി ജീവൻ ക്രിസ്തുവത്രേ",
        "മരിക്കിലുമെനിക്കതു ലാഭമത്രേ",
        "മനമേ യേശു മതി",
        "ദിനവും തൻചരണം ഗതി"
      ]
    },
    {
      "id": "s1",
      "kind": "stanza",
      "label": "1",
      "lines": [
        "പലവിധ ശോധന നേരിടുകിൽ",
        "ഇനിമലപോൽ തിരനിരയുയർന്നിടുകിൽ",
        "കലങ്ങുകയില്ല ഞാനവനരികിൽ",
        "അലകളിൻ മീതെ വന്നിടുകിൽ"
      ]
    },
    {
      "id": "s2",
      "kind": "stanza",
      "label": "2",
      "lines": [
        "ഇരിക്കുകിൽ തൻ വയലിൽ",
        "പരിശ്രമിക്കും ഞാൻ",
        "മരിക്കുകിൽ തന്നരികിൽ വിശ്രമിക്കും",
        "ഒരിക്കലുമൊന്നിനും ഭാരമില്ലാ -",
        "തിരിക്കുമെൻ ഭാഗ്യത്തിനിണയില്ല"
      ]
    },
    {
      "id": "s3",
      "kind": "stanza",
      "label": "3",
      "lines": [
        "പരത്തിലാണെന്നുടെ പൗരത്വം",
        "ഇനി വരുമവിടുന്നെൻ പ്രാണപ്രിയൻ",
        "മണ്മയമാമെന്നുടലന്നു വിണ്മയമാം",
        "എൻ വിന തീരും"
      ]
    }
  ],
  "sequence": [
    {
      "partId": "c"
    },
    {
      "partId": "s1"
    },
    {
      "partId": "c"
    },
    {
      "partId": "s2"
    },
    {
      "partId": "c"
    },
    {
      "partId": "s3"
    },
    {
      "partId": "c"
    }
  ],
  "meta": {
    "author": "MEC"
  }
}
