{
  "number": 561,
  "title": "നമ്മൾക്കുലകിൽ സങ്കടമെന്തി",
  "parts": [
    {
      "id": "c",
      "kind": "chorus",
      "lines": [
        "നമ്മൾക്കുലകിൽ സങ്കടമെന്തി",
        "ന്നേശുവുണ്ടല്ലോ",
        "ആരിലുമുന്നതനായൊരു മന്നവ",
        "നേശുവുണ്ടല്ലോ! യേശുവുണ്ടല്ലോ!"
      ]
    },
    {
      "id": "s1",
      "kind": "stanza",
      "label": "1",
      "lines": [
        "ആപത്തിൽ കൂട്ടുനിൽപ്പാൻ",
        "താപത്തിൽ പാട്ടുനൽകാൻ",
        "ഭാരങ്ങൾ ഏറ്റുകൊൾവാൻ",
        "യേശുവുണ്ടല്ലോ"
      ]
    },
    {
      "id": "s2",
      "kind": "stanza",
      "label": "2",
      "lines": [
        "കല്യാണവീടതിൽ",
        "വീഞ്ഞില്ലാതെ വന്നനേരം",
        "വെളളം വീഞ്ഞായ്",
        "കൊടുത്തോരേശുവുണ്ടല്ലോ"
      ]
    },
    {
      "id": "s3",
      "kind": "stanza",
      "label": "3",
      "lines": [
        "വിശക്കുന്ന പുരുഷാരം",
        "വിലപിക്കും വിധവയീ",
        "വകക്കാർക്കും മതിയായോ",
        "രേശുവുണ്ടല്ലോ"
      ]
    },
    {
      "id": "s4",
      "kind": "stanza",
      "label": "4",
      "lines": [
        "ലാസർ തൻ മരണത്തിൽ",
        "ക്ലേശിച്ച ഭവനസ്ഥർ",
        "ആശ്വസിച്ചതിൻ മൂല",
        "മേശുവുണ്ടല്ലോ"
      ]
    },
    {
      "id": "s5",
      "kind": "stanza",
      "label": "5",
      "lines": [
        "പാപത്തിൻ കൂലി തന്റെ",
        "ദേഹത്തിലേറ്റു നമ്മെ",
        "നാശത്തിൽ നിന്നു",
        "മോചിച്ചേശുവുണ്ടല്ലോ"
      ]
    },
    {
      "id": "s6",
      "kind": "stanza",
      "label": "6",
      "lines": [
        "മതിമാനാം നേതാവായ്",
        "മൃതിവെന്ന ജേതാവായ്",
        "പുതുജീവദാതാവായ്",
        "യേശുവുണ്ടല്ലോ"
      ]
    }
  ],
  "sequence": [
    {
      "partId": "c"
    },
    {
      "partId": "s1"
    },
    {
      "partId": "c"
    },
    {
      "partId": "s2"
    },
    {
      "partId": "c"
    },
    {
      "partId": "s3"
    },
    {
      "partId": "c"
    },
    {
      "partId": "s4"
    },
    {
      "partId": "c"
    },
    {
      "partId": "s5"
    },
    {
      "partId": "c"
    },
    {
      "partId": "s6"
    },
    {
      "partId": "c"
    }
  ],
  "meta": {
    "author": "TKS"
  }
}
