{
  "number": 1048,
  "title": "ലക്ഷ്യമതാണേ എൻ ആശയതാണേ",
  "parts": [
    {
      "id": "c",
      "kind": "chorus",
      "lines": [
        "ലക്ഷ്യമതാണേ എൻ ആശയതാണേ",
        "എൻ ജീവനാഥനെ",
        "ഞാനെന്നു കാണുമോ"
      ]
    },
    {
      "id": "s1",
      "kind": "stanza",
      "label": "1",
      "lines": [
        "ക്രൂശിൽ യാഗമായ് തൻ ചോരയൂറ്റിയ",
        "എൻ ജീവനാഥനെ ഞാനെന്നു കാണുമോ?",
        "ദേവ ദേവനെ എൻ ത്യാഗവീരനെ",
        "എൻ ജീവിതസുഖം നീ മാത്രമാകുന്നേ!"
      ]
    },
    {
      "id": "s2",
      "kind": "stanza",
      "label": "2",
      "lines": [
        "പ്രത്യാശനാടിനെ ഞാനോർത്തിടുന്നേരം",
        "പ്രത്യാശയെന്നുളളിൽ പൊങ്ങിടുന്നിതാ",
        "നിത്യസൗഭാഗ്യം ലഭ്യമാകുവാൻ",
        "എത്രകാലം ഞാൻ കാത്തിടേണമോ?"
      ]
    },
    {
      "id": "s3",
      "kind": "stanza",
      "label": "3",
      "lines": [
        "പൂർവ്വപിതാക്കൾ നോക്കി പാർത്തതാം",
        "നിത്യസൗധത്തിൽ നാം എത്തിടുവാനായ്",
        "യുവസോദരങ്ങളെ യുവ കേസരികളെ",
        "നാം ഒന്നുചേരുക",
        "ജയക്കൊടി ഉയർത്തുക"
      ]
    },
    {
      "id": "s4",
      "kind": "stanza",
      "label": "4",
      "lines": [
        "ഈ പാഴ്മരുഭൂമി എനിക്കാനന്ദമല്ലേ",
        "സീയോൻ പുരിയതോ അധിക കാമ്യമേ",
        "എന്നു ചെന്നു ഞാൻ വീട്ടിൽ ചേരുമോ",
        "അന്നു തീരുമേ ഈ പാരിൻ ദുരിതം"
      ]
    }
  ],
  "sequence": [
    {
      "partId": "c"
    },
    {
      "partId": "s1"
    },
    {
      "partId": "c"
    },
    {
      "partId": "s2"
    },
    {
      "partId": "c"
    },
    {
      "partId": "s3"
    },
    {
      "partId": "c"
    },
    {
      "partId": "s4"
    },
    {
      "partId": "c"
    }
  ],
  "meta": {}
}
