{
  "number": 398,
  "title": "എന്റെ കർത്താവിൻ പാദത്തിങ്കൽ",
  "parts": [
    {
      "id": "c",
      "kind": "chorus",
      "lines": [
        "എന്റെ കർത്താവിൻ പാദത്തിങ്കൽ",
        "സ്തോത്രയാഗങ്ങൽ അർപ്പിക്കും ഞാൻ",
        "എന്റെ പാപത്തിൻ ശാപത്തെ",
        "നീക്കിയ കർത്തനെ വാഴ്ത്തി",
        "വണങ്ങിടും ഞാൻ"
      ]
    },
    {
      "id": "s1",
      "kind": "stanza",
      "label": "1",
      "lines": [
        "എന്റെ ശിക്ഷകൾ നീക്കിടുവാൻ",
        "യേശു രക്ഷകനായ് വന്നിഹത്തിൽ",
        "എന്റെ ലംഘനങ്ങൾ എല്ലാം ക്ഷമിച്ചു തന്നു",
        "തന്റെ കാൽവറി രക്തത്തിനാൽ"
      ]
    },
    {
      "id": "s2",
      "kind": "stanza",
      "label": "2",
      "lines": [
        "രോഗശോകങ്ങൾ വന്നിടുമ്പോൾ",
        "സൗഖ്യദായകനായ് അരികിൽ വന്ന്",
        "എന്റെ ആകുലങ്ങൾ എല്ലാമകറ്റിയെന്നിൽ",
        "എന്നും ആശ്വാസം പകർന്നിടും താൻ"
      ]
    },
    {
      "id": "s3",
      "kind": "stanza",
      "label": "3",
      "lines": [
        "എന്റെ എതിരികൾ നിരനിരയായ്",
        "ചാരേ അണഞ്ഞിടും സമയമതിൽ",
        "ലോകരക്ഷകനാമേശു നാഥനവൻ",
        "മാർവ്വതിൽ ചേർത്തെന്നെ കാത്തിടുമേ!"
      ]
    }
  ],
  "sequence": [
    {
      "partId": "c"
    },
    {
      "partId": "s1"
    },
    {
      "partId": "c"
    },
    {
      "partId": "s2"
    },
    {
      "partId": "c"
    },
    {
      "partId": "s3"
    },
    {
      "partId": "c"
    }
  ],
  "meta": {
    "author": "PUT"
  }
}
