{
  "number": 670,
  "title": "അന്യോന്യം സ്നേഹിക്കുവിൻ",
  "parts": [
    {
      "id": "c",
      "kind": "chorus",
      "lines": [
        "അന്യോന്യം സ്നേഹിക്കുവിൻ",
        "നിങ്ങൾ അന്യോന്യം സ്നേഹിക്കുവിൻ",
        "സ്നേഹിച്ചു ജീവൻ തന്നവൻ നാഥൻ",
        "സ്നേഹമായോതുന്നിതാ"
      ]
    },
    {
      "id": "s1",
      "kind": "stanza",
      "label": "1",
      "lines": [
        "അന്യർ തൻ ദുഃഖത്തിൽപങ്കു",
        "ചേർന്നിടണം ആർദ്രത കാട്ടിടണം",
        "ഉളളതിൽപങ്കു നാം അഗതികൾക്കായ്",
        "അറിഞ്ഞു നല്കേണം മടിച്ചിടാതെ"
      ]
    },
    {
      "id": "s2",
      "kind": "stanza",
      "label": "2",
      "lines": [
        "ദൈവത്തിൻ നൽസ്നേഹം ഉളളിലു -",
        "ളളാരുമേ ആരോടും കോപിക്കില്ല",
        "എല്ലാം സഹിക്കുവാൻ ക്ഷമിച്ചിടുവാൻ",
        "ക്രിസ്തേശു നമ്മോടോതിയല്ലോ"
      ]
    },
    {
      "id": "s3",
      "kind": "stanza",
      "label": "3",
      "lines": [
        "അയല്ക്കാരെ നമ്മൾ",
        "സ്നേഹിക്കാതെങ്ങനെ",
        "ദൈവത്തെ സ്നേഹിച്ചിടും?",
        "ക്രിസ്തുവിൻ താഴ്മ നാം ധരിച്ചിടണം",
        "എളിയവരെയാദരിച്ചിടണം"
      ]
    }
  ],
  "sequence": [
    {
      "partId": "c"
    },
    {
      "partId": "s1"
    },
    {
      "partId": "c"
    },
    {
      "partId": "s2"
    },
    {
      "partId": "c"
    },
    {
      "partId": "s3"
    },
    {
      "partId": "c"
    }
  ],
  "meta": {
    "author": "AV"
  }
}
