{
  "number": 829,
  "title": "എന്റെ യേശുവേ! നാഥാ!",
  "parts": [
    {
      "id": "c",
      "kind": "chorus",
      "lines": [
        "എന്റെ യേശുവേ! നാഥാ!",
        "എന്റെ സ്വർഗ്ഗീയ താതാ!",
        "എന്നുമഭയം നീ എന്നുമഭയം നീ"
      ]
    },
    {
      "id": "s1",
      "kind": "stanza",
      "label": "1",
      "lines": [
        "എല്ലാം നീയറിയുന്നുവല്ലോ",
        "എന്നെയും നീയറിയുന്നുവല്ലോ",
        "നിന്നെ ഞാൻ സ്നേഹിച്ചിടുന്നുവെന്നു",
        "നന്നായി നീയറിഞ്ഞിടുന്നു"
      ]
    },
    {
      "id": "s2",
      "kind": "stanza",
      "label": "2",
      "lines": [
        "തിരുഹിതമറിഞ്ഞുകൊണ്ടീ",
        "മരുവിലെൻ ജീവിതം ഞാൻ",
        "പുലർത്തിടുവാൻ കൃപയേകിടണമേ",
        "അലിവുളള നായകനേ!"
      ]
    },
    {
      "id": "s3",
      "kind": "stanza",
      "label": "3",
      "lines": [
        "ആശ്രിതവത്സലനേ!",
        "ആനന്ദദായകനേ!",
        "അഗതികളടിയങ്ങൾക്കെന്നുമഭയം",
        "അരുളണമേ സദയം"
      ]
    }
  ],
  "sequence": [
    {
      "partId": "c"
    },
    {
      "partId": "s1"
    },
    {
      "partId": "c"
    },
    {
      "partId": "s2"
    },
    {
      "partId": "c"
    },
    {
      "partId": "s3"
    },
    {
      "partId": "c"
    }
  ],
  "meta": {
    "author": "GK"
  }
}
