{
  "number": 1154,
  "title": "പരമസുതനാം മശിഹ ഭൂവനേ",
  "parts": [
    {
      "id": "c",
      "kind": "chorus",
      "lines": [
        "പരമസുതനാം മശിഹ ഭൂവനേ",
        "മനുജാ!നിന്നെ",
        "തിരവാൻ കനിവായ് വന്നു",
        "കരുതേണമിതു മനസ്സിൽ"
      ]
    },
    {
      "id": "s1",
      "kind": "stanza",
      "label": "1",
      "lines": [
        "തവ പാപഭാരം നീക്കാൻ മനോഹര",
        "രൂപൻ താൻ യാഗമായ്",
        "തിരുമരണമതാൽ ലഭ്യം",
        "വിമോചനമേവർക്കും",
        "വിശ്വാസമതിൽ വച്ചാൽ",
        "ഇതു താൻ സുവിശേഷമഹോ!"
      ]
    },
    {
      "id": "s2",
      "kind": "stanza",
      "label": "2",
      "lines": [
        "തിരുവേദമതോതിടും",
        "വിലയേറുമീ വാർത്ത സോദരാ!",
        "കരുതാതെയിനി പോയാൽ",
        "വന്നിടും തീരാത്ത",
        "ശിക്ഷാവിധിയെന്നോർക്ക",
        "ഒരു മാറ്റവുമില്ലാതെ"
      ]
    }
  ],
  "sequence": [
    {
      "partId": "c"
    },
    {
      "partId": "s1"
    },
    {
      "partId": "c"
    },
    {
      "partId": "s2"
    },
    {
      "partId": "c"
    }
  ],
  "meta": {
    "author": "TMD"
  }
}
